{
  "article_id": "40400275102233",
  "title": "FWD The One Life Insurance Cover",
  "url": "https://help.gcash.com/hc/en-us/articles/40400275102233-FWD-The-One-Life-Insurance-Cover",
  "content": "#### ADVISORY:\n\nBank Transfer to Maya will be right back! Our partner is working to restore the service as soon as possible.\n\n## Articles in this section\n\n- [Buy Load Insurance](https://help.gcash.com/hc/en-us/articles/44941586246169-Buy-Load-Insurance)\n- [Oona Big 3 Critical Illness Insurance](https://help.gcash.com/hc/en-us/articles/43706196341785-Oona-Big-3-Critical-Illness-Insurance)\n- [Oona Infinity Travel Insurance](https://help.gcash.com/hc/en-us/articles/43702716959001-Oona-Infinity-Travel-Insurance)\n- [FWD The One Life Insurance Cover](https://help.gcash.com/hc/en-us/articles/40400275102233-FWD-The-One-Life-Insurance-Cover)\n- [FWD BIG 3 Critical Illness Insurance](https://help.gcash.com/hc/en-us/articles/40399755316633-FWD-BIG-3-Critical-Illness-Insurance)\n- [Singlife 3-in-1 Protection Plan](https://help.gcash.com/hc/en-us/articles/8242221911449-Singlife-3-in-1-Protection-Plan)\n- [Singlife 100 in 1 Medical](https://help.gcash.com/hc/en-us/articles/25994481758489-Singlife-100-in-1-Medical)\n- [Singlife Cash for Medical Costs](https://help.gcash.com/hc/en-us/articles/6694784138009-Singlife-Cash-for-Medical-Costs)\n\n## Promoted articles\n\n- [What are the steps to get a Fully Verified GCash account?](https://help.gcash.com/hc/en-us/articles/360017722393-What-are-the-steps-to-get-a-Fully-Verified-GCash-account)\n- [Accepted IDs for GCash Verification](https://help.gcash.com/hc/en-us/articles/900000948786-Accepted-IDs-for-GCash-Verification)\n- [How do I send money to another GCash account?](https://help.gcash.com/hc/en-us/articles/360017566614-How-do-I-send-money-to-another-GCash-account)\n\nThe FWD The One Life InsuranceCover lets you choose a plan, add-on benefits, and coverage amount that suits your needs and lifestyle. It offers customizable coverage for every phase of life, from Gen Z to those up to 70 years old.\n\nJump to:\n\n- [Eligibility](https://help.gcash.com/hc/en-us/articles/40400275102233-FWD-The-One-Life-Insurance-Cover#h_01JDH70MF6MGBTX2528JB2428S)\n- [Coverage](https://help.gcash.com/hc/en-us/articles/40400275102233-FWD-The-One-Life-Insurance-Cover#h_01JDH70MF6VEN4XD09FP4QM7A2)\n- [Purchase FWD The One Life InsuranceCover](https://help.gcash.com/hc/en-us/articles/40400275102233-FWD-The-One-Life-Insurance-Cover#h_01JDH70MF6AWV3QYT50Y9Q0QHB)\n- [Cancellation and Claims](https://help.gcash.com/hc/en-us/articles/40400275102233-FWD-The-One-Life-Insurance-Cover#h_01JDH70MF65W9FFET6C9CBRS83)\n- [Contact FWD](https://help.gcash.com/hc/en-us/articles/40400275102233-FWD-The-One-Life-Insurance-Cover#h_01JDH70MF6NKDCQM2YSEAGTBDM)\n\n## Eligibility\n\nYou can avail of this product if you are:\n\n- At least 18-70 years old\n- A [Fully Verified](https://help.gcash.com/hc/en-us/articles/360017722393-What-are-the-steps-to-get-a-Fully-Verified-GCash-account#h_01FPYEDSZ597DXA7JF5NWD6PBC) GCash user\n- In good health, able to work and do daily activities without any help\n- A Filipino citizen or a foreigner who is a legal resident of the Philippines for at least 6 months\n\n**Note:**\n\nYou cannot buy this policy for someone else directly.\n\n## Coverage\n\nWith FWD The One Life Insurance Cover, you are provided with the following benefits **until age 79**:\n\n**FWD The One for Life Insurance Cover Benefits:**\n\n- Death Benefit\n- Accidental Death Benefit\n- Critical Illness Benefit\n\nYou can choose a plan that includes one, two, or all three of these benefits:\n\n- **Death Benefit** Your beneficiaries will receive a Death Benefit if you pass away.\n- **Accidental Death Benefit** Add this to your plan to provide a cash benefit to your beneficiaries if you pass away due to an accident.\n- **Critical Illness Benefit** Add coverage for critical illness and claim a benefit amount if youâ€™re diagnosed with any of the 42 covered major critical illnesses.\n\n**Plan Variants:**\n\n- Death, Accidental Death, & Critical Illness Benefits\n- Death & Accidental Death Benefits\n- Death & Critical Illness Benefits\n- Death Benefit\n\n**Note:**\n\nYou are covered while you are outside of the Philippines except for COVID-19. The cash benefit payable will be in Philippine pesos.\n\n## Purchase FWD The One Life Insurance Cover\n\n**Note:** You can buy multiple plans, but the total benefit amount cannot exceed Php 2,000,000 for Critical Illness (CI) and Php 5,000,000 for Digital products.\n\nTo purchase FWD The One Life insurance product follow the steps below:\n\n1. On your GCash app, tap **GInsure** \\> **Life**\n2. Select the The One Life Insurance product.\n3. Fill out the application form with the required details and agree to the health declarations.\n4. Complete the payment process.\n\nYou will receive a confirmation page of the successful payment of your chosen policy.\n\nFWD will send your e-policy within **24-42 hours** of completing the application and payment. You'll receive it via your registered email, which will also be accessible on the Policy Page in the GCash app.\n\nYou can also check a copy in the app [Omne by FWD](https://www.fwd.com.ph/support/omne-by-fwd/).\n\nPremium payments will be **automatically deducted** from your GCash e-wallet on the due dates. Make sure your GCash balance is sufficient to keep your policy active.\n\n## Cancellation and Claims\n\n### **Cancellation**\n\nYou are entitled to a free-look period which will run for 15 days upon issuance of the policy. During this period, you may review the policy provisions, inclusions, and exclusions.\n\nIf you decide to cancel your policy within the free-look period, you may do so on the Omne by FWD app, contact their 24/7 Customer Connect at +632 8888 8388, or email CustomerConnect.ph@fwd.com, to get a full refund.\n\n**Claims**\n\n**When can claims not be paid? \\[dropdown\\]**\n\nFor Death Benefit\n\nYou cannot claim if death is due to attempted suicide or deliberate self-harm while the insured is sane within 2 years from the policy's effective date. In such cases, FWD will return all paid premiums to the beneficiaries.\n\nFor Accidental Death Benefit\n\nFWD will not pay any benefit if the claim arises from committing an illegal or unlawful act (including a terrorist act), failure to act, war or any act of war (whether declared or not), or any civil or military uprising.\n\nFor Critical Illness Benefit\n\nNo major critical illness benefit will be paid if signs of the condition appear within the no-claim period, even if the condition is diagnosed after the period by a medical practitioner. FWD also do not pay for claims arising from pre-existing conditions. Claims related to drug or alcohol abuse, HIV, psychiatric-related causes, suicide, self-inflicted acts, unlawful acts, and war are also excluded.\n\nTo file a claim, you can reach FWD through any of the following:\n\n- **24/7 Customer Connect:** Call +632 8888 8388\n- **Email:** CustomerConnect.ph@fwd.com or claimsconnect.ph@fwd.com\n- **Omne by FWD App:** Submit your claim directly through the app\n\nA dedicated FWD Claims Ambassador will be assigned to assist you personally.\n\n## Contact FWD Insurance\n\nTo contact FWD, check out their available channels below:\n\n- **24/7 Customer Connect:** Call +632 8888 8388\n- **Email:** CustomerConnect.ph@fwd.com or claimsconnect.ph@fwd.com\n- **Omne by FWD App:** Submit your claim directly through the app\n\n[Previous](https://help.gcash.com/hc/en-us/articles/43702716959001-Oona-Infinity-Travel-Insurance)\n\nOona Infinity Travel Insurance\n\n[Next](https://help.gcash.com/hc/en-us/articles/40399755316633-FWD-BIG-3-Critical-Illness-Insurance)\n\nFWD BIG 3 Critical Illness Insurance\n\n- [Buy Load Insurance](https://help.gcash.com/hc/en-us/articles/44941586246169-Buy-Load-Insurance)\n- [Oona Big 3 Critical Illness Insurance](https://help.gcash.com/hc/en-us/articles/43706196341785-Oona-Big-3-Critical-Illness-Insurance)\n- [Oona Infinity Travel Insurance](https://help.gcash.com/hc/en-us/articles/43702716959001-Oona-Infinity-Travel-Insurance)\n- [FWD The One Life Insurance Cover](https://help.gcash.com/hc/en-us/articles/40400275102233-FWD-The-One-Life-Insurance-Cover)\n- [FWD BIG 3 Critical Illness Insurance](https://help.gcash.com/hc/en-us/articles/40399755316633-FWD-BIG-3-Critical-Illness-Insurance)\n- [Singlife 3-in-1 Protection Plan](https://help.gcash.com/hc/en-us/articles/8242221911449-Singlife-3-in-1-Protection-Plan)\n- [Singlife 100 in 1 Medical](https://help.gcash.com/hc/en-us/articles/25994481758489-Singlife-100-in-1-Medical)\n- [Singlife Cash for Medical Costs](https://help.gcash.com/hc/en-us/articles/6694784138009-Singlife-Cash-for-Medical-Costs)\n\n40400275102233\n\nBack to Top",
  "categories": [
    "Buy Load Insurance",
    "Oona Big 3 Critical Illness Insurance",
    "Oona Infinity Travel Insurance",
    "FWD The One Life Insurance Cover",
    "FWD BIG 3 Critical Illness Insurance",
    "Singlife 3-in-1 Protection Plan",
    "Singlife 100 in 1 Medical",
    "Singlife Cash for Medical Costs"
  ],
  "related_articles": [
    {
      "title": "Buy Load Insurance",
      "url": "https://help.gcash.com/hc/en-us/articles/44941586246169-Buy-Load-Insurance"
    },
    {
      "title": "Oona Big 3 Critical Illness Insurance",
      "url": "https://help.gcash.com/hc/en-us/articles/43706196341785-Oona-Big-3-Critical-Illness-Insurance"
    },
    {
      "title": "Oona Infinity Travel Insurance",
      "url": "https://help.gcash.com/hc/en-us/articles/43702716959001-Oona-Infinity-Travel-Insurance"
    },
    {
      "title": "FWD The One Life Insurance Cover",
      "url": "https://help.gcash.com/hc/en-us/articles/40400275102233-FWD-The-One-Life-Insurance-Cover"
    },
    {
      "title": "FWD BIG 3 Critical Illness Insurance",
      "url": "https://help.gcash.com/hc/en-us/articles/40399755316633-FWD-BIG-3-Critical-Illness-Insurance"
    },
    {
      "title": "Singlife 3-in-1 Protection Plan",
      "url": "https://help.gcash.com/hc/en-us/articles/8242221911449-Singlife-3-in-1-Protection-Plan"
    },
    {
      "title": "Singlife 100 in 1 Medical",
      "url": "https://help.gcash.com/hc/en-us/articles/25994481758489-Singlife-100-in-1-Medical"
    },
    {
      "title": "Singlife Cash for Medical Costs",
      "url": "https://help.gcash.com/hc/en-us/articles/6694784138009-Singlife-Cash-for-Medical-Costs"
    },
    {
      "title": "What are the steps to get a Fully Verified GCash account?",
      "url": "https://help.gcash.com/hc/en-us/articles/360017722393-What-are-the-steps-to-get-a-Fully-Verified-GCash-account"
    },
    {
      "title": "Accepted IDs for GCash Verification",
      "url": "https://help.gcash.com/hc/en-us/articles/900000948786-Accepted-IDs-for-GCash-Verification"
    },
    {
      "title": "How do I send money to another GCash account?",
      "url": "https://help.gcash.com/hc/en-us/articles/360017566614-How-do-I-send-money-to-another-GCash-account"
    },
    {
      "title": "Eligibility",
      "url": "https://help.gcash.com/hc/en-us/articles/40400275102233-FWD-The-One-Life-Insurance-Cover#h_01JDH70MF6MGBTX2528JB2428S"
    },
    {
      "title": "Coverage",
      "url": "https://help.gcash.com/hc/en-us/articles/40400275102233-FWD-The-One-Life-Insurance-Cover#h_01JDH70MF6VEN4XD09FP4QM7A2"
    },
    {
      "title": "Purchase FWD The One Life InsuranceCover",
      "url": "https://help.gcash.com/hc/en-us/articles/40400275102233-FWD-The-One-Life-Insurance-Cover#h_01JDH70MF6AWV3QYT50Y9Q0QHB"
    },
    {
      "title": "Cancellation and Claims",
      "url": "https://help.gcash.com/hc/en-us/articles/40400275102233-FWD-The-One-Life-Insurance-Cover#h_01JDH70MF65W9FFET6C9CBRS83"
    },
    {
      "title": "Contact FWD",
      "url": "https://help.gcash.com/hc/en-us/articles/40400275102233-FWD-The-One-Life-Insurance-Cover#h_01JDH70MF6NKDCQM2YSEAGTBDM"
    },
    {
      "title": "Fully Verified",
      "url": "https://help.gcash.com/hc/en-us/articles/360017722393-What-are-the-steps-to-get-a-Fully-Verified-GCash-account#h_01FPYEDSZ597DXA7JF5NWD6PBC"
    },
    {
      "title": "Previous",
      "url": "https://help.gcash.com/hc/en-us/articles/43702716959001-Oona-Infinity-Travel-Insurance"
    },
    {
      "title": "Next",
      "url": "https://help.gcash.com/hc/en-us/articles/40399755316633-FWD-BIG-3-Critical-Illness-Insurance"
    }
  ],
  "images": [],
  "jump_links": [
    {
      "title": "Eligibility",
      "anchor": "https://help.gcash.com/hc/en-us/articles/40400275102233-FWD-The-One-Life-Insurance-Cover#h_01JDH70MF6MGBTX2528JB2428S"
    },
    {
      "title": "Coverage",
      "anchor": "https://help.gcash.com/hc/en-us/articles/40400275102233-FWD-The-One-Life-Insurance-Cover#h_01JDH70MF6VEN4XD09FP4QM7A2"
    },
    {
      "title": "Purchase FWD The One Life InsuranceCover",
      "anchor": "https://help.gcash.com/hc/en-us/articles/40400275102233-FWD-The-One-Life-Insurance-Cover#h_01JDH70MF6AWV3QYT50Y9Q0QHB"
    },
    {
      "title": "Cancellation and Claims",
      "anchor": "https://help.gcash.com/hc/en-us/articles/40400275102233-FWD-The-One-Life-Insurance-Cover#h_01JDH70MF65W9FFET6C9CBRS83"
    },
    {
      "title": "Contact FWD",
      "anchor": "https://help.gcash.com/hc/en-us/articles/40400275102233-FWD-The-One-Life-Insurance-Cover#h_01JDH70MF6NKDCQM2YSEAGTBDM"
    }
  ],
  "description": "The FWD The One Life InsuranceCover lets you choose a plan, add-on benefits, and coverage amount that suits your needs and lifestyle. It...",
  "eligibility": "You can avail of this product if you are:\n\n- At least 18-70 years old\n- A [Fully Verified](https://help.gcash.com/hc/en-us/articles/360017722393-What-are-the-steps-to-get-a-Fully-Verified-GCash-account#h_01FPYEDSZ597DXA7JF5NWD6PBC) GCash user\n- In good health, able to work and do daily activities without any help\n- A Filipino citizen or a foreigner who is a legal resident of the Philippines for at least 6 months\n\n**Note:**\n\nYou cannot buy this policy for someone else directly.",
  "coverage": "With FWD The One Life Insurance Cover, you are provided with the following benefits **until age 79**:\n\n**FWD The One for Life Insurance Cover Benefits:**\n\n- Death Benefit\n- Accidental Death Benefit\n- Critical Illness Benefit\n\nYou can choose a plan that includes one, two, or all three of these benefits:\n\n- **Death Benefit** Your beneficiaries will receive a Death Benefit if you pass away.\n- **Accidental Death Benefit** Add this to your plan to provide a cash benefit to your beneficiaries if you pass away due to an accident.\n- **Critical Illness Benefit** Add coverage for critical illness and claim a benefit amount if youâ€™re diagnosed with any of the 42 covered major critical illnesses.\n\n**Plan Variants:**\n\n- Death, Accidental Death, & Critical Illness Benefits\n- Death & Accidental Death Benefits\n- Death & Critical Illness Benefits\n- Death Benefit\n\n**Note:**\n\nYou are covered while you are outside of the Philippines except for COVID-19. The cash benefit payable will be in Philippine pesos."
}