{
  "article_id": "13809239424409",
  "title": "SIM Card Registration Frequently Asked Questions",
  "url": "https://help.gcash.com/hc/en-us/articles/13809239424409-SIM-Card-Registration-Frequently-Asked-Questions",
  "content": "#### ADVISORY:\n\nBank Transfer to Maya will be right back! Our partner is working to restore the service as soon as possible.\n\n## Articles in this section\n\n- [I want to update my address or work information in GCash](https://help.gcash.com/hc/en-us/articles/45260364962329-I-want-to-update-my-address-or-work-information-in-GCash)\n- [I want to update my GCash email address](https://help.gcash.com/hc/en-us/articles/45259632531225-I-want-to-update-my-GCash-email-address)\n- [I want to update my name or birthdate in my GCash account](https://help.gcash.com/hc/en-us/articles/360034342914-I-want-to-update-my-name-or-birthdate-in-my-GCash-account)\n- [I want to change my mobile number linked to my GCash account](https://help.gcash.com/hc/en-us/articles/9059222758041-I-want-to-change-my-mobile-number-linked-to-my-GCash-account)\n- [My GCash account is on hold. How can I access my account?](https://help.gcash.com/hc/en-us/articles/18374080547609-My-GCash-account-is-on-hold-How-can-I-access-my-account)\n- [I was Fully Verified, why was my GCash account downgraded to a basic account?](https://help.gcash.com/hc/en-us/articles/31782046693529-I-was-Fully-Verified-why-was-my-GCash-account-downgraded-to-a-basic-account)\n- [GScore](https://help.gcash.com/hc/en-us/articles/360017566894-GScore)\n- [How do I transfer money and services from my old GCash account to my new one?](https://help.gcash.com/hc/en-us/articles/5857695373081-How-do-I-transfer-money-and-services-from-my-old-GCash-account-to-my-new-one)\n- [How do I claim my money from a suspended GCash Basic account?](https://help.gcash.com/hc/en-us/articles/38827343196185-How-do-I-claim-my-money-from-a-suspended-GCash-Basic-account)\n- [Why was my GCash account deactivated?](https://help.gcash.com/hc/en-us/articles/19643426242201-Why-was-my-GCash-account-deactivated)\n\n[See more](https://help.gcash.com/hc/en-us/sections/360004657754-Manage-Your-Account)\n\n## Promoted articles\n\n- [What are the steps to get a Fully Verified GCash account?](https://help.gcash.com/hc/en-us/articles/360017722393-What-are-the-steps-to-get-a-Fully-Verified-GCash-account)\n- [Accepted IDs for GCash Verification](https://help.gcash.com/hc/en-us/articles/900000948786-Accepted-IDs-for-GCash-Verification)\n- [How do I send money to another GCash account?](https://help.gcash.com/hc/en-us/articles/360017566614-How-do-I-send-money-to-another-GCash-account)\n\n### **What is the SIM Registration Act?**\n\nThe SIM Registration Act requires ALL SIM cards to be registered with their telco providers as a requirement for their activation. Registration aims to protect consumers from illegal activities such as mobile scams, smishing, and fraud.\n\n### **Until when can I register my SIM?**\n\nRegistration with telco providers ended **July 25, 2023.**\n\n### **What happens to my GCash account or wallet if I do not register my SIM?**\n\nYour GCash account and your funds will remain secure. You may [update the mobile number linked to your GCash account](https://help.gcash.com/hc/articles/9059222758041) to recover your GCash account linked to your deactivated or unregistered SIM.\n\n![photo_2023-04-28_08-58-19.jpg](https://help.gcash.com/hc/article_attachments/17986247615129)\n\n### **I received an email that my GCash will be restricted due to the SIM Registration Act and is directing me to input my details. What should I do?**\n\nSIM registrations will only be collected and processed by your telco providers through the channels they have provided. GCash will not ask for any information on behalf of the telco provider.\n\nPlease also be reminded that **GCash****will never send links via SMS, emails, or any other messaging apps**. Remember never to share your GCash credentials such as MPIN or OTP to anyone or anywhere except when you are logging in to the GCash app. Learn more about how to [keep your account safe](https://help.gcash.com/hc/en-us/articles/4413281262105).\n\nIf you think you’ve been a target of phishing, [learn how to spot and report unauthorized transactions in your account](https://help.gcash.com/hc/en-us/articles/4416637093145).\n\n### **What happens to my GCash Account if I successfully register my SIM to my telco?**\n\nYour GCash account will remain as is and you may continue to enjoy all GCash services. Your successful SIM registration ensures that the mobile number registered to your GCash account will continue to be active.\n\n### **I want to change my number. How do I move my funds to my new account?**\n\nYou may [update the mobile number linked to your GCash account](https://help.gcash.com/hc/articles/9059222758041) to recover your GCash account linked to your deactivated or unregistered SIM.\n\nPlease make sure that your new mobile number is registered with your own telco provider to ensure its activation.\n\n### **Am I required to register all my SIMs linked to my GCash accounts with telco providers?**\n\nYes, all the SIM cards linked to all your GCash accounts with your respective telco provider must be registered.\n\n### **My child has a GCash Jr account, is s/he required to register his/her SIM Card as well?**\n\nAll SIM cards are required to be registered according to the SIM Registration Act. For minors, the registration of the SIM shall be under the name of the minor’s parent or legal guardian.\n\n### **I am Foreign National (not a Filipino) with a GCash Account, am I required to register my SIM cards as well?**\n\nAll Philippine SIM cards are required to be registered according to the SIM Registration Act. Foreign Nationals will also be included in the SIM Registration process.\n\n### **I am a Globe user with a fully verified GCash account. What happens if I do not register my SIM?**\n\nYou may visit the [Globe SIM Registration page](https://new.globe.com.ph/simreg) to comply with your Telco's SIM Registration guidelines.\n\nYou may reach out to your Telco provider via the Globe Stores or Globe Facebook Messenger for more information.\n\n[Previous](https://help.gcash.com/hc/en-us/articles/30423145328153-Privacy-Choices-Dashboard)\n\nPrivacy Choices Dashboard\n\n[Next](https://help.gcash.com/hc/en-us/articles/40524922109209-Can-I-create-a-GCash-account-if-I-did-not-register-my-SIM-Card)\n\nCan I create a GCash account if I did not register my SIM Card?\n\n- [I want to update my address or work information in GCash](https://help.gcash.com/hc/en-us/articles/45260364962329-I-want-to-update-my-address-or-work-information-in-GCash)\n- [I want to update my GCash email address](https://help.gcash.com/hc/en-us/articles/45259632531225-I-want-to-update-my-GCash-email-address)\n- [I want to update my name or birthdate in my GCash account](https://help.gcash.com/hc/en-us/articles/360034342914-I-want-to-update-my-name-or-birthdate-in-my-GCash-account)\n- [I want to change my mobile number linked to my GCash account](https://help.gcash.com/hc/en-us/articles/9059222758041-I-want-to-change-my-mobile-number-linked-to-my-GCash-account)\n- [My GCash account is on hold. How can I access my account?](https://help.gcash.com/hc/en-us/articles/18374080547609-My-GCash-account-is-on-hold-How-can-I-access-my-account)\n- [I was Fully Verified, why was my GCash account downgraded to a basic account?](https://help.gcash.com/hc/en-us/articles/31782046693529-I-was-Fully-Verified-why-was-my-GCash-account-downgraded-to-a-basic-account)\n- [GScore](https://help.gcash.com/hc/en-us/articles/360017566894-GScore)\n- [How do I transfer money and services from my old GCash account to my new one?](https://help.gcash.com/hc/en-us/articles/5857695373081-How-do-I-transfer-money-and-services-from-my-old-GCash-account-to-my-new-one)\n- [How do I claim my money from a suspended GCash Basic account?](https://help.gcash.com/hc/en-us/articles/38827343196185-How-do-I-claim-my-money-from-a-suspended-GCash-Basic-account)\n- [Why was my GCash account deactivated?](https://help.gcash.com/hc/en-us/articles/19643426242201-Why-was-my-GCash-account-deactivated)\n- [Privacy Choices Dashboard](https://help.gcash.com/hc/en-us/articles/30423145328153-Privacy-Choices-Dashboard)\n- [SIM Card Registration Frequently Asked Questions](https://help.gcash.com/hc/en-us/articles/13809239424409-SIM-Card-Registration-Frequently-Asked-Questions)\n- [Can I create a GCash account if I did not register my SIM Card?](https://help.gcash.com/hc/en-us/articles/40524922109209-Can-I-create-a-GCash-account-if-I-did-not-register-my-SIM-Card)\n- [The GCash SSO (Single Sign-On) is not working. What do I do?](https://help.gcash.com/hc/en-us/articles/29370042746137-The-GCash-SSO-Single-Sign-On-is-not-working-What-do-I-do)\n- [How do I delete or close my GCash account?](https://help.gcash.com/hc/en-us/articles/900005315866-How-do-I-delete-or-close-my-GCash-account)\n\n13809239424409\n\nBack to Top",
  "categories": [
    "I want to update my address or work information in GCash",
    "I want to update my GCash email address",
    "I want to update my name or birthdate in my GCash account",
    "I want to change my mobile number linked to my GCash account",
    "My GCash account is on hold. How can I access my account?",
    "I was Fully Verified, why was my GCash account downgraded to a basic account?",
    "GScore",
    "How do I transfer money and services from my old GCash account to my new one?",
    "How do I claim my money from a suspended GCash Basic account?",
    "Why was my GCash account deactivated?"
  ],
  "related_articles": [
    {
      "title": "I want to update my address or work information in GCash",
      "url": "https://help.gcash.com/hc/en-us/articles/45260364962329-I-want-to-update-my-address-or-work-information-in-GCash"
    },
    {
      "title": "I want to update my GCash email address",
      "url": "https://help.gcash.com/hc/en-us/articles/45259632531225-I-want-to-update-my-GCash-email-address"
    },
    {
      "title": "I want to update my name or birthdate in my GCash account",
      "url": "https://help.gcash.com/hc/en-us/articles/360034342914-I-want-to-update-my-name-or-birthdate-in-my-GCash-account"
    },
    {
      "title": "I want to change my mobile number linked to my GCash account",
      "url": "https://help.gcash.com/hc/en-us/articles/9059222758041-I-want-to-change-my-mobile-number-linked-to-my-GCash-account"
    },
    {
      "title": "My GCash account is on hold. How can I access my account?",
      "url": "https://help.gcash.com/hc/en-us/articles/18374080547609-My-GCash-account-is-on-hold-How-can-I-access-my-account"
    },
    {
      "title": "I was Fully Verified, why was my GCash account downgraded to a basic account?",
      "url": "https://help.gcash.com/hc/en-us/articles/31782046693529-I-was-Fully-Verified-why-was-my-GCash-account-downgraded-to-a-basic-account"
    },
    {
      "title": "GScore",
      "url": "https://help.gcash.com/hc/en-us/articles/360017566894-GScore"
    },
    {
      "title": "How do I transfer money and services from my old GCash account to my new one?",
      "url": "https://help.gcash.com/hc/en-us/articles/5857695373081-How-do-I-transfer-money-and-services-from-my-old-GCash-account-to-my-new-one"
    },
    {
      "title": "How do I claim my money from a suspended GCash Basic account?",
      "url": "https://help.gcash.com/hc/en-us/articles/38827343196185-How-do-I-claim-my-money-from-a-suspended-GCash-Basic-account"
    },
    {
      "title": "Why was my GCash account deactivated?",
      "url": "https://help.gcash.com/hc/en-us/articles/19643426242201-Why-was-my-GCash-account-deactivated"
    },
    {
      "title": "What are the steps to get a Fully Verified GCash account?",
      "url": "https://help.gcash.com/hc/en-us/articles/360017722393-What-are-the-steps-to-get-a-Fully-Verified-GCash-account"
    },
    {
      "title": "Accepted IDs for GCash Verification",
      "url": "https://help.gcash.com/hc/en-us/articles/900000948786-Accepted-IDs-for-GCash-Verification"
    },
    {
      "title": "How do I send money to another GCash account?",
      "url": "https://help.gcash.com/hc/en-us/articles/360017566614-How-do-I-send-money-to-another-GCash-account"
    },
    {
      "title": "keep your account safe",
      "url": "https://help.gcash.com/hc/en-us/articles/4413281262105"
    },
    {
      "title": "learn how to spot and report unauthorized transactions in your account",
      "url": "https://help.gcash.com/hc/en-us/articles/4416637093145"
    },
    {
      "title": "Previous",
      "url": "https://help.gcash.com/hc/en-us/articles/30423145328153-Privacy-Choices-Dashboard"
    },
    {
      "title": "Next",
      "url": "https://help.gcash.com/hc/en-us/articles/40524922109209-Can-I-create-a-GCash-account-if-I-did-not-register-my-SIM-Card"
    },
    {
      "title": "Privacy Choices Dashboard",
      "url": "https://help.gcash.com/hc/en-us/articles/30423145328153-Privacy-Choices-Dashboard"
    },
    {
      "title": "SIM Card Registration Frequently Asked Questions",
      "url": "https://help.gcash.com/hc/en-us/articles/13809239424409-SIM-Card-Registration-Frequently-Asked-Questions"
    },
    {
      "title": "Can I create a GCash account if I did not register my SIM Card?",
      "url": "https://help.gcash.com/hc/en-us/articles/40524922109209-Can-I-create-a-GCash-account-if-I-did-not-register-my-SIM-Card"
    },
    {
      "title": "The GCash SSO (Single Sign-On) is not working. What do I do?",
      "url": "https://help.gcash.com/hc/en-us/articles/29370042746137-The-GCash-SSO-Single-Sign-On-is-not-working-What-do-I-do"
    },
    {
      "title": "How do I delete or close my GCash account?",
      "url": "https://help.gcash.com/hc/en-us/articles/900005315866-How-do-I-delete-or-close-my-GCash-account"
    }
  ],
  "images": [
    {
      "alt_text": "photo_2023-04-28_08-58-19.jpg",
      "url": "https://help.gcash.com/hc/article_attachments/17986247615129"
    }
  ],
  "jump_links": [],
  "description": "What is the SIM Registration Act? The SIM Registration Act requires ALL SIM cards to be registered with their telco providers as a..."
}